{
  "name": "Mert Yaşin",
  "title": "Lead Software Engineer",
  "documentTitle": "Mert Yaşin ▸ CV",
  "description": "The complete CV, rendered from JSON and open sourced as a template. Download it as a PDF with working links.",
  "contact": {
    "phone": "+90 538 470 03 93",
    "email": "mert.yasin@gmail.com",
    "github": {
      "url": "https://github.com/mrtysn",
      "label": "github.com/mrtysn"
    },
    "linkedin": {
      "url": "https://www.linkedin.com/in/mert-yasin/",
      "label": "linkedin.com/in/mert-yasin"
    }
  }
}
